LOCID,BEGDEPTH,ENDDEPTH,LOGDATE,ASTMCODE,HS_UNIT,VISDESC,USER_COMMENTS,lithcode
MW58-COE,0,9,1993-06-10T06:00:00Z,SM,NA,"BROWN TO LIGHT TAN SILTY FINE TO COARSE SAND, SOME MICA, SAPROLITIC, NO ODOR.",NA,SILTY SAND
MW58-COE,9,12,1993-06-10T06:00:00Z,ML,NA,"REDDISH BROWN, FINE TO COARSE SANDY SILT, SOME CLAY, MOIST, VERY SLIGHT ODOR.",NA,SILT
MW59-COE,1,2.5,1993-06-12T06:00:00Z,MH,NA,"ORANGE FAT SILT, SOME CLAY, TRACE MICA AND FINE GRAINED SAND, DRY, NO ODOR.",NA,SILT
MW59-COE,18.5,19.5,1993-06-12T06:00:00Z,ML,NA,"MOIST, MODERATE FUEL ODOR.",NA,SILT
MW59-COE,10.5,18.5,1993-06-12T06:00:00Z,ML,NA,"TAN LEAN SILT, SOME SAND AND CLAY, TRACE MICA, DRY, NO ODOR.",NA,SILT
MW59-COE,32,45,1993-06-12T06:00:00Z,NDPS,NA,NO LITHOLOGIC DESCRIPTION PROVIDED.,NA,NDPS
MW59-COE,2.5,5,1993-06-12T06:00:00Z,ML,NA,"LIGHT BROWN, BROWN AND RED LEAN SILT, SOME SAND, TRACE CLAY AND MICA, DRY, NO ODOR.",NA,SILT
MW59-COE,5,9,1993-06-12T06:00:00Z,MH,NA,"ORANGE FAT SILT, SOME SAND AND CLAY, TRACE MICA AND FINE GRAINED GRAVEL, DRY, NO ODOR.",NA,SILT
MW59-COE,9,10.5,1993-06-12T06:00:00Z,SM,NA,"TAN FINE TO MEDIUM GRAINED SILTY SAND, TRACE MICA, DRY, NO ODOR.",NA,SILTY SAND
MW59-COE,19.5,24.5,1993-06-12T06:00:00Z,ML,NA,TRACE GNEISSIC BANDING.,NA,SILT
MW59-COE,0,1,1993-06-12T06:00:00Z,CM,NA,ASPHALT AND GRAVEL FILL.,NA,SILTY CLAY
MW59-COE,24.5,32,1993-06-12T06:00:00Z,ML,NA,STRONG FUEL ODOR.,NA,SILT
MW60-COE,6,9,1993-06-13T06:00:00Z,SM,NA,SAPROLITIC MATERIAL WITH FINE GRAINED QUARTZ GRAVEL AND WEATHERED PLAGIOCLASE FROM 6.0 TO 7.0 FEET.,NA,SILTY SAND
MW60-COE,0,2,1993-06-13T06:00:00Z,SM,NA,"TAN FINE TO MEDIUM GRAINED SILTY SAND, TRACE MICA, DRY, NO ODOR.",NA,SILTY SAND
MW60-COE,19,20.5,1993-06-13T06:00:00Z,GP,NA,"SOME FINE GRAINED QUARTZ GRAVEL, SATURATED, STRONG ODOR.",NA,GRAVEL
MW60-COE,14.5,19,1993-06-13T06:00:00Z,GM,NA,"WHITE, GRAY AND BROWN SAPROLITIC MATERIAL WITH POORLY SORTED QUARTZ SAND AND WEATHERED PLAGIOCLASE, SOME MICA, MOIST, MODERATE ODOR.",NA,SILTY GRAVEL
MW60-COE,2,6,1993-06-13T06:00:00Z,SM,NA,"GRAY FINE GRAINED SILTY SAND, DRY, NO ODOR.",NA,SILTY SAND
MW60-COE,20.5,34.5,1993-06-13T06:00:00Z,NDPS,NA,NO LITHOLOGIC DESCRIPTION PROVIDED.,NA,NDPS
MW60-COE,9,14.5,1993-06-13T06:00:00Z,SM,NA,"LIGHT BROWN TO LIGHT GRAY FINE TO MEDIUM GRAINED SILTY SAND, SLIGHT ODOR.",NA,SILTY SAND
MW9,0.16,13,1983-01-08T07:00:00Z,ML,NA,"REDDISH BROWN MICACEOUS SANDY SILT, MEDIUM TO SOFT TO VERY HARD",NA,SILT
MW9,13,34,1983-01-08T07:00:00Z,ML,NA,"BROWN MICACEOUS SILT WITH A TRACE OF FINE SAND, FIRM TO HARD TO MEDIUM TO FIRM, WATER TABLE AT 15.5' AFTER 16 DAYS",NA,SILT
MW9,0,0.16,1983-01-08T07:00:00Z,SM,NA,DARK BROWN SILTY SAND WITH SOME ORGANICS,NA,SILTY SAND
MW99-01A,5,11,1999-08-10T06:00:00Z,NA,NA,GRAY ROCK (WEATHERED).,NA,NA
MW99-01A,118.7,187.5,1999-08-10T06:00:00Z,NA,NA,DARK GRAY/BLACK GNEISS WITH TRACES OF QUARTZ AND PINK GARNET.,NA,NA
MW99-01A,187.5,197,1999-08-10T06:00:00Z,NDPS,NA,NO DESCRIPTION,NA,NDPS
MW99-01A,11,25,1999-08-10T06:00:00Z,NA,NA,GRAY ROCK (SOLID).,NA,NA
MW99-01A,0,5,1999-08-10T06:00:00Z,SM,NA,RED SILTY SAND.,NA,SILTY SAND
MW99-01A,108.7,118.7,1999-08-10T06:00:00Z,NDPS,NA,NO DESCRIPTION,NA,NDPS
MW99-01A,25,108.7,1999-08-10T06:00:00Z,NA,NA,DARK GRAY/BLACK GNEISS WITH TRACES OF QUARTZ AND PINK GARNET.,NA,NA
MW99-01B,0,5.5,1999-06-17T06:00:00Z,ML,NA,RED SANDY SILT.,NA,SILT
MW99-01B,5.5,8,1999-06-17T06:00:00Z,NA,NA,RED WEATHERED ROCK.,NA,NA
MW99-01B,8,80,1999-06-17T06:00:00Z,NA,NA,"GRAY ROCK (SOLID); DARK GRAY, BLACK GNEISS WITH SOME GRANITE AND PINK GARNET.",NA,NA
MW99-02A,6,13,1999-08-09T06:00:00Z,ML,NA,"GRAY SANDY SILT, LAYERED AND WEATHERED.",NA,SILT
MW99-02A,25,29.4,1999-08-09T06:00:00Z,NA,NA,ROCK (SOLID).,NA,NA
MW99-02A,0,6,1999-08-09T06:00:00Z,SM,NA,"BROWNISH RED, SILTY SAND (MICACEOUS(.",NA,SILTY SAND
MW99-02A,32.9,41.6,1999-08-09T06:00:00Z,NDPS,NA,NO DESCRIPTION,NA,NDPS
MW99-02A,13,20,1999-08-09T06:00:00Z,ML,NA,"BROWNISH RED, SANDY SILT, WEATHERED AND LAYERED (SAPROLITE), MOIST.",NA,SILT
MW99-02A,120,210,1999-08-09T06:00:00Z,NA,NA,DARK BRAY/BLACK GNEISS WITH SOME QUARTZ AND TRACE OF GARNET.,NA,NA
MW99-02A,41.6,120,1999-08-09T06:00:00Z,NDPS,NA,NO LITHOLOGIC DESCRIPTION PROVIDED.,NA,NDPS
MW99-02A,29.4,32.9,1999-08-09T06:00:00Z,NA,NA,DARK GRAY/BLACK GNEISS WITH TRACE OF QUARTZ.,NA,NA
MW99-02A,20,25,1999-08-09T06:00:00Z,NA,NA,GRAY WEATHERED ROCK.,NA,NA
MW99-02B,0,12,1999-06-11T06:00:00Z,NDPS,NA,NO DESCRIPTION,NA,NDPS
MW99-02B,17,25,1999-06-11T06:00:00Z,NA,NA,SOLID ROCK.,NA,NA
MW99-02B,12,17,1999-06-11T06:00:00Z,NA,NA,????????????? WEATHERED ROCK.,NA,NA
MW99-03A,25,32,1999-08-08T06:00:00Z,SP,NA,"GRAY TO BLACK TO REDDISH BROWN, VERY MICACEOUS, COARSE SAND (SAPROLITE).",NA,SAND
MW99-03A,52,220,1999-08-08T06:00:00Z,NA,NA,"DARK GRAY/BLACK GNEISS WITH SOME QUARTZ AND MICA, OCCASIONAL TRACE OF PINK QUARTZ.",NA,NA
MW99-03A,20,25,1999-08-08T06:00:00Z,MH,NA,"TAN, BLACK, BROWN, VERY MICACEOUS SAPROLITE.",NA,SILT
MW99-03A,0,4,1999-08-08T06:00:00Z,ML,NA,"REDDISH BROWN, MICACEOUS, FINE, SANDY SILT.",NA,SILT
MW99-03A,32,52,1999-08-08T06:00:00Z,NA,NA,ROCK.,NA,NA
MW99-03A,4,20,1999-08-08T06:00:00Z,SW,NA,"TAN/WHITE MICACEOUS SAND, TRACE RED/BROWN MICACEOUS FINE SAND, VERY WEATHERED PARENT MATERIAL, SOME LAYERED STRUCTURE (SAPROLITE).",NA,SAND
MW99-03B,37.4,49.5,1999-08-08T06:00:00Z,NA,NA,"SOLID ROCK, DARK GRAY/BLACK GNEISS WITH TRACE OF QUARTZ AND GARNET.",NA,NA
MW99-03B,0,23,1999-08-08T06:00:00Z,NDPS,NA,NO DESCRIPTION,NA,NDPS
MW99-03B,23,31.7,1999-08-08T06:00:00Z,NA,NA,"WEATHERED ROCK, NO RECOVERY, (SEE BEDROCK CORE LOG 99-03B FOR DESCRIPTION)",NA,NA
MW99-03B,31.7,37.4,1999-08-08T06:00:00Z,NDPS,NA,FRACTURED WITH STAINING.,NA,NDPS
MWG1,120,130,1985-12-13T07:00:00Z,NACM,NA,"MODERATELY SOFT TO HARD GRAY AND WHITE FRACTURES WITH STAINS, INCOMPETENT BIOTITE-QUARTZ-PLAGIOCLASE GNEISS WITH SOIL SEAMS",NA,NACM
MWG1,111,117.5,1985-12-13T07:00:00Z,NA,NA,"VERY SOFT WEATHERED ROCK, NO RECOVERY LIKELY",NA,NA
MWG1,117.5,120,1985-12-13T07:00:00Z,NACM,NA,"SOFT TO MODERATELY HARD DARK GRAY FRACTURES WITH STAINS, INCOMPETENT MICA SCHIST WITH QUARTZ STRINGERS",NA,NACM
MWG1,108.5,111,1985-12-13T07:00:00Z,NA,NA,tri-cone drilling.,NA,NA
MWG1,135.5,141,1985-12-13T07:00:00Z,NACM,NA,"MODERATELY HARD, DARK GRAY, BROKEN, INCOMPETENT MICA-GARNET SCHIST WITH STAINED VERTICAL FRACTURES",NA,NACM
MWG1,141,150,1985-12-13T07:00:00Z,NACM,NA,"MODERATELY HARD TO HARD, GRAY AND WHITE, FRACTURES WITH STAINS, INCOMPETENT BIOTITE-PLAGIOCLASE-QUARTZ GNEISS",NA,NACM
MWG1,0,108.5,1985-12-13T07:00:00Z,NA,NA,driller noted rock lense at 25-25.4' and weathered rock from 38-108.5. see MW-G1A for soil/rock description 0-54.5'.,NA,NA
MWG1,130,131.3,1985-12-13T07:00:00Z,NA,NA,TRI-CONE DRILLING,NA,NA
MWG1,131.3,135.5,1985-12-13T07:00:00Z,NACM,NA,"MODERATELY HARD,GRAY AND WHITE FRACTURES WITH STAINS, INCOMPETENT, BIOTITE-QUARTZ-PLAGIOCLASE GNEISS",NA,NACM
MWG1,0,111,1985-12-13T07:00:00Z,NDPS,NA,"MUD ROTARY DRILLING, NO RECOVERY",NA,NDPS
MWG10,31,75,1985-12-14T07:00:00Z,ML,NA,"FIRM TO STIFF GRAY SILT, LITTLE FINE SAND, MICACEOUS (WEATHERED SCHIST)",NA,SILT
MWG10,75,90,1985-12-14T07:00:00Z,SM,NA,"PARTIALLY WEATHERED ROCK, SAMPLED AS VERY DENSE, TAN TO WHITE, FINE TO MEDIUM SAND, SOME SILT, MICACEOUS (WEATHERED GNEISS)",NA,SILTY SAND
MWG10,0,27,1985-12-14T07:00:00Z,ML,NA,"FILL. SOFT TO HARD, BROWN CLAYEY SILT, LITTLE FINE SAND WITH FRAGMENTS OF ROCK, CONCRETE, WOOD, AND METAL. BUILDERS OF ROCK AND/OR CONCRETE ENCOUNTERED AT 2, 7, 14, 16 AND 20 FT.",NA,SILT
MWG10,27,27.5,1985-12-14T07:00:00Z,PT,NA,TOPSOIL,NA,PT
MWG10,27.5,31,1985-12-14T07:00:00Z,ML,NA,"SOFT TO FIRM RED BROWN CLAYEY SILT, LITTLE FINE SAND, SLIGHTLY MICACEOUS",NA,SILT
MWG11,55.7,60.8,1985-12-03T07:00:00Z,NA,NA,"AUGER REFUSAL, TRI-CONE DRILLING",NA,NA
MWG11,64.5,80.5,1985-12-03T07:00:00Z,NACM,NA,"SOFT TO MODERATELY HARD GRAY AND WHITE, FRAGMENTED, INCOMPETENT MICA SCHIST WITH SOFT WEATHERED SEAMS 70.1-78.7 FT. (LOSS OF DRILLING WATER)",NA,NACM
MWG11,45.5,55.7,1985-12-03T07:00:00Z,SM,NA,"PARTIALLY WEATHERED ROCK, SAMPLED AS VERY DENSE, BROWN TO WHITE, FINE TO MEDIUM SAND, SOME SILT, MICACEOUS",NA,SILTY SAND
MWG11,110,120.1,1985-12-03T07:00:00Z,NA,NA,"HARD, DARK GRAY GREEN TO GRAY, SOLID, CONTINUOS, QUARTZ-MICA-CHLORITE GNEISS WITH STAINED FRACTURES AT 111.5 AND 114 FT.",NA,NA
MWG11,28,35.5,1985-12-03T07:00:00Z,ML,NA,"SOFT BROWN SILT, LITTLE FINE SAND, VERY MICACEOUS",NA,SILT
MWG11,60.8,64.5,1985-12-03T07:00:00Z,NA,NA,VERY SOFT CORING PROBABLE CORE LOSS (WEATHERED ROCK AND SOIL),NA,NA
MWG11,109,120.1,1985-12-03T07:00:00Z,NACM,NA,"hard dark gray green to gray, solid, continuous, quartz-mica-chlorite gneiss with stained fractures at 111.5 and 114.0'.",NA,NACM
MWG11,35.5,39,1985-12-03T07:00:00Z,SM,NA,"PARTIALLY WEATHERED ROCK, SAMPLED AS VERY DENSE, RED BROWN TO WHITE, FINE TO COARSE SAND, SOME CLAYEY SILT, MICACEOUS",NA,SILTY SAND
MWG11,8,13,1985-12-03T07:00:00Z,SM,NA,"LOOSE TAN TO BROWN, FINE TO MEDIUM SAND, SOME SILT, MICACEOUS",NA,SILTY SAND
MWG11,4,8,1985-12-03T07:00:00Z,ML,NA,"FIRM TO STIFF, GRAY AND WHITE SILT, SOME FINE SAND, MICACEOUS QUARTZ FRAGMENTS",NA,SILT
MWG11,39,45.5,1985-12-03T07:00:00Z,ML,NA,"FIRM, BROWN, SILT, SOME FINE SAND, MICACEOUS",NA,SILT
MWG11,90.3,110,1985-12-03T07:00:00Z,NA,NA,"HARD, WHITE, SOLID, CONTINUOUS QUARTZ-PLAGIOCLASE-MICA GNEISS, SOFT SEAM 103.8-104.3",NA,NA
MWG11,90.3,109,1985-12-03T07:00:00Z,NACM,NA,"hard, white, solid, continuous quartz-plagioclase-mica gneiss. soft seam 103.8-104.3'.",NA,NACM
MWG11,0,0.5,1985-12-03T07:00:00Z,GP,NA,GRAVEL,NA,GRAVEL
MWG11,13,23,1985-12-03T07:00:00Z,ML,NA,"FIRM TO STIFF, BROWN, SILT, SOME FINE SAND, MICACEOUS",NA,SILT
MWG11,80.5,90.3,1985-12-03T07:00:00Z,NACM,NA,"MODERATELY HARD WHITE AND BLACK, BROKEN, INCOMPETENT, PLAGIOCLASE-QUARTZ-MICA GNEISS",NA,NACM
MWG11,0.5,4,1985-12-03T07:00:00Z,SM,NA,"FILL. DARK GRAY TO TAN FINE TO MEDIUM SAND, SOME CLAYEY SILT",NA,SILTY SAND
MWG11,23,28,1985-12-03T07:00:00Z,SM,NA,"COMPACT, TAN AND WHITE, FINE TO MEDIUM SAND, SOME SILT, MICACEOUS",NA,SILTY SAND
MWG12,24.8,84.7,1985-11-19T07:00:00Z,NA,NA,"MODERATELY HARD TO HARD, WHITE AND GRAY, FAIRLY SOLID, CONTINUOUS QUARTZ-PLAGIOCLASE-BIOTITE GNEISS, MORE SCHISTOSE 59-63 FT. AND 77-79 FT., FRACTURES WITH STAINS AT 53.4, 70.5, AND 75.5 FT., GARNETS ABUNDANT 80-84.7 FT.",NA,NA
MWG12,18.5,20.7,1985-11-19T07:00:00Z,ML,NA,"PARTIALLY WEATHERED ROCK, SAMPLED AS HARD GRAY SILT, SOME FINE SAND",NA,SILT
MWG12,0,0.5,1985-11-19T07:00:00Z,NA,NA,ASPHALT,NA,NA
MWG12,0.5,1.5,1985-11-19T07:00:00Z,GC,NA,CRUSHED STONE,NA,CLAYEY GRAVEL
MWG12,13.5,18.5,1985-11-19T07:00:00Z,ML,NA,"HARD, RED BROWN TO GRAY, SILT, SOME FINE SAND",NA,SILT
MWG12,20.7,24.8,1985-11-19T07:00:00Z,NA,NA,"MODERATELY SOFT TO HARD GRAY AND TAN, FRACTURED WITH STAINS, INCOMPETENT, QUARTZ-PLAGIOCLASE-BIOTITE GNEISS",NA,NA
MWG12,1.5,13.5,1985-11-19T07:00:00Z,ML,NA,"COMPACT, LIGHT BROWN, SILT, SOME FINE SAND, MICACEOUS",NA,SILT
MWG14,22.1,26,1986-01-09T07:00:00Z,NA,NA,"MODERATELY SOFT TO MODERATELY HARD, DARK GRAY AND BROWN, FRAGMENTED, INCOMPETENT, MICA SCHIST WITH STAINED FRACTURES",NA,NA
MWG14,13,22.1,1986-01-09T07:00:00Z,SM,NA,"PARTIALLY WEATHERED ROCK, SAMPLED AS VERY DENSE, TAN AND WHITE, FINE TO MEDIUM SAND, SOME SILT, MICACEOUS (WEATHERED GNEISS)",NA,SILTY SAND
MWG14,26,28,1986-01-09T07:00:00Z,NA,NA,"MODERATELY SOFT TO HARD, TAN AND GRAY, BROKEN, INCOMPETENT QUARTZ-PLAGIOCLASE-BIOTITE GNEISS WITH STAINED FRACTURES",NA,NA
MWG14,0,0.8,1986-01-09T07:00:00Z,NA,NA,ASPHALT,NA,NA
MWG14,0.8,13,1986-01-09T07:00:00Z,SM,NA,"DENSE TO VERY DENSE, RED BROWN TO TAN, FINE SAND, SOME CLAYEY SILT, MICACEOUS",NA,SILTY SAND
MWG14,28,40.8,1986-01-09T07:00:00Z,NA,NA,"HARD WHITE TO GRAY SOLID, CONTINUOUS, QUARTZ-PLAGIOCLASE-BIOTITE-GARNET GNEISS WITH THIN (.5) LAYERS OF MICA SCHIST 20-30 FT.",NA,NA
MWG15,6.5,12,1985-12-10T07:00:00Z,ML,NA,"STIFF TO HARD, RED, BROWN TO ORANGE BROWN, CLAYEY SILT, SOME FINE SAND",NA,SILT
MWG15,12,23.5,1985-12-10T07:00:00Z,SM,NA,"COMPACT TO DENSE, GRAY AND WHITE FINE SAND, SOME SILT, MICACEOUS",NA,SILTY SAND
MWG15,33.5,37.7,1985-12-10T07:00:00Z,NDPS,NA,"AUGER REFUSAL, TRI-CONE DRILLING, NO SAMPLES TAKEN",NA,NDPS
MWG15,0,6.5,1985-12-10T07:00:00Z,ML,NA,"FILL. STIFF RED BROWN AND BROWN, CLAYEY SILT, SOME FINE SAND",NA,SILT
MWG15,23.5,33.5,1985-12-10T07:00:00Z,SM,NA,"PARTIALLY WEATHERED ROCK, SAMPLED AS VERY DENSE, GRAY AND WHITE, FINE SAND, SOME SILT, MICACEOUS (WEATHERED GNEISS)",NA,SILTY SAND
MWG16,0,0.5,1985-12-12T07:00:00Z,NA,NA,ASPHALT & CRUSHED STONE,NA,NA
MWG16,11,16.3,1985-12-12T07:00:00Z,SM,NA,"PARTIALLY WEATHERED ROCK, SAMPLED AS VERY DENSE, RED BROWN, FINE SAND, SOME SILT, MICACEOUS",NA,SILTY SAND
MWG16,16.3,36,1985-12-12T07:00:00Z,NDPS,NA,"AUGER REFUSAL, TRI-CONE DRILLING, NO SAMPLES OBTAINED (MEDIUM TO HARD ROCK)",NA,NDPS
MWG16,0.5,11,1985-12-12T07:00:00Z,ML,NA,"FILL. SOFT TO STIFF, RED BROWN CLAYEY SILT, SOME FINE SAND, MICACEOUS",NA,SILT
MWG17,10,10.5,1985-12-11T07:00:00Z,NA,NA,ROCK LENSE,NA,NA
MWG17,24,29.5,1985-12-11T07:00:00Z,NA,NA,"HARD, DARK GRAY AND WHITE, BROKEN, FAIRLY CONTINUOUS, QUARTZ-PLAGIOCLASE-BIOTITE GNEISS, FRACTURES WITH STAINS AT 24.5, 26, AND 29 FT.",NA,NA
MWG17,11,24,1985-12-11T07:00:00Z,NA,NA,"MODERATELY HARD TO HARD GRAY AND WHITE, FRACTURED WITH STAINS, INCOMPETENT TO FAIRLY CONTINUOUS QUARTZ-PLAGIOCLASE-BIOTITE GNEISS WEATHERED SEAMS AT 12, 16.5-17, AND 18-19 FT.",NA,NA
MWG17,0,10,1985-12-11T07:00:00Z,SM,NA,"DENSE, RED BROWN, FINE SAND AND CLAYEY SILT",NA,SILTY SAND
MWG17,10.5,11,1985-12-11T07:00:00Z,NA,NA,WEATHERED ROCK,NA,NA
MWG19,0.8,8,1985-12-12T07:00:00Z,ML,NA,"FILL. SOFT TO STIFF, RED BROWN CLAYEY SILT, SOME FINE SAND, MICACEOUS",NA,SILT
MWG19,31.5,39.5,1985-12-12T07:00:00Z,NA,NA,"HARD, WHITE AND GRAY, FAIRLY SOLID, CONTINUOUS, QUARTZ-PLAGIOCLASE-BIOTITE GNEISS WITH STAINED FRACTURES AT 34.7, 38.5, AND 39.3 FT.",NA,NA
MWG19,25,31.5,1985-12-12T07:00:00Z,NA,NA,"HARD, GRAY, SOLID, CONTINUOUS, MICA SCHIST W/STAINED FRACTURES AT 29.5 FT.",NA,NA
MWG19,39.5,60.5,1985-12-12T07:00:00Z,NDPS,NA,TRI-CONE DRILLING NO SAMPLES OBTAINED,NA,NDPS
MWG19,20,25,1985-12-12T07:00:00Z,NA,NA,"MODERATELY HARD TO HARD, WHITE AND GRAY, BROKEN, COMPETENT, QUARTZ",NA,NA
MWG19,8,15.8,1985-12-12T07:00:00Z,SM,NA,"PARTIALLY WEATHERED ROCK, SAMPLED AS VERY DENSE, RED BROWN, FINE SAND, SOME SILT, MICACEOUS",NA,SILTY SAND
MWG19,15.8,20,1985-12-12T07:00:00Z,NDPS,NA,"AUGER REFUSAL, TRI-CONE DRILLING",NA,NDPS
MWG19,0,0.8,1985-12-12T07:00:00Z,NA,NA,ASPHALT & CRUSHED STONE,NA,NA
MWG1A,1.5,41,1985-11-20T07:00:00Z,ML,NA,"FILL. FIRM TO STIFF, RED BROWN AND BROWN, SILT. SOME FINE SAND, SLIGHTLY MICACEOUS",NA,SILT
MWG1A,53.2,54.5,1985-11-20T07:00:00Z,NA,NA,"HARD GRAY AND WHITE FRACTURED WITH STAINS, INCOMPETENT BIOTITE-QUARTZ-PLAGIOCLASE GNEISS",NA,NA
MWG1A,54.5,72,1985-11-20T07:00:00Z,NDPS,NA,TRI-CONE DRILLING,NA,NDPS
MWG1A,41,44.7,1985-11-20T07:00:00Z,NDPS,NA,AUGER REFUSAL - NO CORE RECOVERY - WEATHERED ROCK,NA,NDPS
MWG1A,44.7,53.2,1985-11-20T07:00:00Z,NDPS,NA,TRI-CONE DRILLING,NA,NDPS
MWG1A,0,0.5,1985-11-20T07:00:00Z,NA,NA,6 ASPHALT,NA,NA
MWG1A,0.5,1.5,1985-11-20T07:00:00Z,GC,NA,CRUSHED STONE,NA,CLAYEY GRAVEL
MWG2,73,85.4,1985-11-30T07:00:00Z,SM,NA,"FIRM TO VERY DENSE WHITE AND BROWN FINE TO COARSE SAND. SOME SILT, MICACEOUS (WEATHERED GNEISS)",NA,SILTY SAND
MWG2,39,46,1985-11-30T07:00:00Z,CL,NA,"ALLUVIUM. STIFF GRAY, SILTY CLAY. SOME FINE SAND WITH ORGANIC ODOR",NA,CLAY
MWG2,0,39,1985-11-30T07:00:00Z,ML,NA,"FILL. FIRM TO STIFF RED BROWN AND BROWN SILT. SOME FINE SAND, MICACEOUS",NA,SILT
MWG2,46,73,1985-11-30T07:00:00Z,ML,NA,"STIFF GRAY BROWN TO TAN SILT. SOME FINE SAND, VERY MICACEOUS (WEATHERED SCHIST)",NA,SILT
MWG20,4.5,32.3,1985-12-03T07:00:00Z,NA,NA,"HARD, GRAY AND WHITE, FAIRLY SOLID, COMPETENT TO FAIRLY CONTINUOUS, GARNET MICA SCHIST WITH STAINED FRACTURES AT 6.5, 7, 9, 24 AND 24.5 FT. (MORE GNEISSIC 31-32.3 FT.)",NA,NA
MWG20,1.5,4.5,1985-12-03T07:00:00Z,SM,NA,VERY DENSE BROWN FINE SAND AND SILT,NA,SILTY SAND
MWG20,0,0.5,1985-12-03T07:00:00Z,PT,NA,TOPSOIL,NA,PT
MWG20,0.5,1.5,1985-12-03T07:00:00Z,ML,NA,FILL. SOFT BROWN CLAYEY SILT WITH SOME FINE SAND,NA,SILT
MWG21,20.2,28,1985-12-09T07:00:00Z,NA,NA,"HARD, WHITE AND GRAY, FRACTURES WITH STAINS, INCOMPETENT, QUARTZ-PLAGIOCLASE-BIOTITE GNEISS",NA,NA
MWG21,0,6,1985-12-09T07:00:00Z,ML,NA,"FIRM, RED BROWN, CLAYEY SILT, LITTLE FINE SAND, SLIGHTLY MICACEOUS",NA,SILT
MWG21,10.5,20.2,1985-12-09T07:00:00Z,SM,NA,"PARTIALLY WEATHERED ROCK, SAMPLED AS VERY DENSE, GRAY, FINE SAND, SOME SILT, MICACEOUS",NA,SILTY SAND
MWG21,28,41.7,1985-12-09T07:00:00Z,NA,NA,"HARD, WHITE AND GRAY, FAIRLY SOLID, CONTINUOUS, QUARTZ-PLAGIOCLASE-BIOTITE GNEISS, WITH WEATHERED SEAM AT 52 FT.",NA,NA
MWG21,6,10.5,1985-12-09T07:00:00Z,SM,NA,"PARTIALLY WEATHERED ROCK, SAMPLED AS VERY DENSE, GRAY AND WHITE, FINE SAND, SOME SILT, MICACEOUS",NA,SILTY SAND
MWG22,0,0.5,1985-12-06T07:00:00Z,PT,NA,TOPSOIL,NA,PT
MWG22,35.5,48.2,1985-12-06T07:00:00Z,NA,NA,"MODERATELY HARD TO HARD, GRAY AND WHITE, BROKEN, COMPETENT, QUARTZ-PLAGIOCLASE-BIOTITE GNEISS, WITH STAINED FRACTURES AT 35.5, 37.8, 38.5, 40.3, 42.3 AND 45.8 FT.",NA,NA
MWG22,0.5,18,1985-12-06T07:00:00Z,ML,NA,"FILL. SOFT TO HARD, BROWN AND GRAY, CLAYEY SILT AND FINE SAND WITH ROOTS AND ROCK FRAGMENTS",NA,SILT
MWG22,18,28,1985-12-06T07:00:00Z,SM,NA,"COMPACT TO DENSE, RED BROWN TO GRAY, FINE TO MEDIUM SAND, SOME SILT, MICACEOUS",NA,SILTY SAND
MWG22,28,32.6,1985-12-06T07:00:00Z,SM,NA,"PARTIALLY WEATHERED ROCK, SAMPLED AS VERY DENSE, GRAY TO WHITE, FINE TO MEDIUM SAND, SOME SILT, MICACEOUS",NA,SILTY SAND
MWG22,32.6,35.5,1985-12-06T07:00:00Z,NA,NA,"HARD, WHITE, FRACTURED WITH STAINS, INCOMPETENT, QUARTZ-PLAGIOCLASE-BIOTITE GNEISS",NA,NA
MWG3,63.5,76,1985-11-26T07:00:00Z,SM,NA,"DENSE, WHITE TO PINK, FINE TO MEDIUM SAND, SOME SILT, MICACEOUS (WEATHERED GNEISS)",NA,SILTY SAND
MWG3,21,63.5,1985-11-26T07:00:00Z,ML,NA,"STIFF, ORANGE BROWN TO DARK RED BROWN SILT, TRACE FINE SAND, MICACEOUS WITH THIN (2-6) WEATHERED GRANITE GNEISS LENSES NOTED AT 51, 55, AND 60'",NA,SILT
MWG3,0,21,1985-11-26T07:00:00Z,ML,NA,"FIRM TO STIFF, RED BROWN TO BROWN SILT, TRACE FINE SAND, MICACEOUS WITH ROOTS AND OTHER ORGANICS",NA,SILT
MWG3,76,83.7,1985-11-26T07:00:00Z,ML,NA,"STIFF TO HARD, YELLOW BROWN TO BLACK, SILT, LITTLE FINE SAND, VERY MICACEOUS (WEATHERED AMPHIBOLITE)",NA,SILT
MWG4,62.3,77.3,1986-01-02T07:00:00Z,NACM,NA,"MODERATELY SOFT TO HARD, GRAY AND WHITE, FRACTURES WITH STAINS, COMPETENT, MICA SCHIST WITH THIN (1-2) GRANITE GNEISS SEAMS 66.3-66.0 FT.",NA,NACM
MWG4,11,33,1986-01-02T07:00:00Z,SM,NA,"COMPACT TO VERY DENSE, RED BROWN TO BROWN, FINE SAND WITH SOME CLAYEY SILT",NA,SILTY SAND
MWG4,33,62.3,1986-01-02T07:00:00Z,SM,NA,"PARTIALLY WEATHERED ROCK, SAMPLED AS VERY DENSE BROWN, TAN, AND GRAY FINE SAND, SOME SILT, MICACEOUS (WEATHERED GNEISS)",NA,SILTY SAND
MWG4,0,10.5,1986-01-02T07:00:00Z,ML,NA,"FILL. SOFT TO STIFF, RED BROWN TO BROWN CLAYEY SILT, SOME FINE SAND",NA,SILT
MWG4,10.5,11,1986-01-02T07:00:00Z,PT,NA,TOPSOIL,NA,PT
MWG5,12,19,1985-12-18T07:00:00Z,SM,NA,"ORANGE BROWN, FINE TO MEDIUM SAND, SOME SILT MICACEOUS",NA,SILTY SAND
MWG5,40,66.2,1985-12-18T07:00:00Z,SM,NA,"GRAY AND WHITE, FINE TO COARSE SAND, SOME SILT, MICACEOUS (WEATHERED GNEISS)",NA,SILTY SAND
MWG5,110,124.6,1985-12-18T07:00:00Z,NA,NA,"MODERATELY HARD TO HARD, GRAY AND WHITE, SOLID, CONTINUOUS, QUARTZ-BIOTITE-PLAGIOCLASE GNEISS",NA,NA
MWG5,102.5,110,1985-12-18T07:00:00Z,NA,NA,"MODERATELY HARD TO HARD, GRAY AND WHITE, SOLID, FAIRLY CONTINUOUS TO CONINUOUS, QUARTZ-BIOTITE-PLAGIOCLASE GNEISS",NA,NA
MWG5,77.5,101.5,1985-12-18T07:00:00Z,NA,NA,"MODERATELY HARD TO HARD, GRAY AND WHITE, SOLID, FAIRLY CONTINUOUS TO CONTINUOUS, QUARTZ-BIOTITE-PLAGIOCLASE GNEISS",NA,NA
MWG5,0,12,1985-12-18T07:00:00Z,SM,NA,"FILL. RED BROWN CLAYEY SILT, SOME FINE SAND",NA,SILTY SAND
MWG5,101.5,102.5,1985-12-18T07:00:00Z,NA,NA,"MODERATELY SOFT GRAY BROWN, FRACTURED WITH STAINS, INCOMPETENT MICA SCHIST",NA,NA
MWG5,75,77.5,1985-12-18T07:00:00Z,NACM,NA,"SOFT TO HARD, GRAY, FRAGMENTED, FRACTURED WITH STAINS, INCOMPETENT, MICA SCHIST",NA,NACM
MWG5,19,40,1985-12-18T07:00:00Z,ML,NA,"GRAY SILT, SOME FINE SAND, VERY MICACEOUS (WEATHERED SCHIST)",NA,SILT
MWG5,77.5,124.6,1985-12-18T07:00:00Z,NACM,NA,"moderately hard to hard, gray and white, solid, fairly continuous to continuous, quartz-biotite-plagioclase gneiss w/  moderately soft gray brown, fractured with stains, incompetent mica schist 101.5-102.5'.",NA,NACM
MWG5,66.2,75,1985-12-18T07:00:00Z,NACM,NA,"MODERATELY HARD TO HARD, GRAY AND WHITE, BROKEN, FAIRLY COMPETENT, QUARTZ-BIOTITE-PLAGIOCLASE GNEISS, FRACTURES WITH STAINS 71-71.5 FT. AND 74-74.5 FT.",NA,NACM
MWG5-5,4,19,1985-02-07T07:00:00Z,SM,NA,DENSE AND FIRM BROWN SILTY MICACEOUS FINE SAND,NA,SILTY SAND
MWG5-5,19,49,1985-02-07T07:00:00Z,SM,NA,"DENSE AND VERY DENSE BROWN, PINK, BLACK AND WHITE VERY SILTY MICACEOUS FINE TO MEDIUM SAND",NA,SILTY SAND
MWG5-5,0,4,1985-02-07T07:00:00Z,ML,NA,STIFF RED FINE SANDY CLAYEY SILT - FILL,NA,SILT
MWG5-5,49,50.5,1985-02-07T07:00:00Z,SM,NA,FIRM GRAY SILTY MICACEOUS FINE TO MEDIUM SAND,NA,SILTY SAND
MWG5-5R,0.6,1.2,1997-09-04T06:00:00Z,ML,NA,"FILL, VERY STIFF, RED, MOTTLED (WHITE), VERY FINE TO FINE GRAIN, SILT, LITTLE SAND, NO PLASTICITY, ORGANICS, TRACE MICA, TRACE GRAVEL.",NA,SILT
MWG5-5R,60,70,1997-09-04T06:00:00Z,SM,NA,"DENSE, LIGHT OLIVE BROWN, MOTTLED ( BLACK, OLIVE, YELLOW ), VERY FINE GRAIN , SAND, VERY MICACEOUS, BLACK MANGANESE, WEATHERED GARNETS, 70 DEGREE DIP, WET.",NA,SILTY SAND
MWG5-5R,1.2,8.6,1997-09-04T06:00:00Z,SM,NA,"FILL, DENSE, RED, MOTTLED (ORANGISH RED, WHITE), VERY FINE GRAIN, SAND, SOME SILT, TRACE GRAVEL, TRACE MICA, DRY. CHANGING TO (2.5YR 4/8), RED, VERY MICACEOUS, LITTLE SILT AT 4'.",NA,SILTY SAND
MWG5-5R,58.8,60,1997-09-04T06:00:00Z,SM,NA,"YELLOWISH BROWN, VERY FINE GRAIN, SAND AT 59.2 FT., LIGHT GRAY, WEATHERED GNEISS, MOTTLED ( WHITE ).",NA,SILTY SAND
MWG5-5R,0,0.6,1997-09-04T06:00:00Z,SM,NA,"FILL, MEDIUM DENSE,  YELLOWISH BROWN, HOMOGENEOUS, VERY FINE GRAIN, SAND, SOME SILT, ORGANICS, TRACE GRAVEL, DRY.",NA,SILTY SAND
MWG5-5R,70,80,1997-09-04T06:00:00Z,SM,NA,"DENSE, LIGHT OLIVE BROWN, MOTTLED ( BLACK, OLIVE, YELLOW ), VERY FINE GRAIN , SAND, VERY MICACEOUS, BLACK MANGANESE, SOME SILT, WET.",NA,SILTY SAND
MWG5-5R,40,50,1997-09-04T06:00:00Z,SM,NA,"DENSE, LIGHT OLIVE BROWN, MOTTLED ( BLACK, GRAY ), VERY FINE GRAIN, SAND, SOME SILT, BLACK MAGANESE IN 10% OF FOLIATIONS, WET, VERY MICACEOUS. AT 48.5 COARSE GRAIN, VERY WEATHERED GARNETS, 49.2- 49.4FT: STRONG BROWN LAYER ( 7.5YR 5/8 )",NA,SILTY SAND
MWG5-5R,30,40,1997-09-04T06:00:00Z,SM,NA,"DENSE, LIGHT OLIVE BROWN, MOTTLED ( GRAY, RED, BLACK, LIGHT BROWN ) VERY FINE TO FINE GRAIN, SAND, SOME SILT, VERY MICACEOUS, BLACK MANGENESE IN FOLIATION PLANTS, 80 DEGREE DIP, VERY MOIST. (WEATHERED SAPROLITE )",NA,SILTY SAND
MWG5-5R,8.6,10,1997-09-04T06:00:00Z,SM,NA,"MEDIUM DENSE,  WHITE, HOMOGENEOUS, VERY FINE TO COARSE GRAIN, SAND, VERY POORLY SORTED, DRY. (WEATHERED GNEISS).",NA,SILTY SAND
MWG5-5R,10,20,1997-09-04T06:00:00Z,SM,NA,"VERY DENSE, WEAK RED, MOTTLED (LIGHT BROWN), VERY FINE GRAIN, SAND, LITTLE SILT, LITTLE MICA, MOIST. (WEATHERED SAPROLITE) WHITE VERY POORLY SORTED GNEISS AT 19'.",NA,SILTY SAND
MWG5-5R,80,83,1997-09-04T06:00:00Z,SM,NA,"VERY DENSE, LIGHT OLIVE BROWN, MOTTLED ( BLSCK, VERY DARK GRAY ), VERY FINE GRAIN, SAND, SOME SILT, VERY MICACEOUS, MANGANESE IN FOLIATIONS, 20 DEGREE DIP, WET. AUGER REFUSAL AT 83 FT.",NA,SILTY SAND
MWG5-5R,21,27,1997-09-04T06:00:00Z,SM,NA,"DENSE, YELLOWISH BROWN, MOTTLED (BLACK, WHITE, RED), VERY FINE GRAIN, SAND, SOME SILT, BLACK MANGANESE VEIN, VERY MICACEOUS, MOIST. WEATHERED GNEISS COBBLE 23.6 - 23.8, RED PINK MINIMAL MOTTLED IN TOP 0.4 FT.",NA,SILTY SAND
MWG5-5R,27,30,1997-09-04T06:00:00Z,SM,NA,"COLOR CHANGE TO LIGHT OLIVE BROWN, MOTTLED ( GRAY, WHITE, RED, BLACK, PINK ), AT 29.2FT. WHITE WEATHERED GNEISS, VERY POORLY SORTED, TRACE WEATHERED GARNETS.",NA,SILTY SAND
MWG5-5R,20,21,1997-09-04T06:00:00Z,SM,NA,"WHITE WEATHERED GNEISS, VERY POORLY SORTED.",NA,SILTY SAND
MWG5-5R,50,58.8,1997-09-04T06:00:00Z,SM,NA,"DENSE, LIGHT OLIVE BROWN, MOTTLED ( BLACK, OLIVE, YELLOW ), VERY FINE GRAIN, SAND, SOME SILT, VERY MICACEOUS, BLACK MANGANESE IN FOLIATION, TRACE WEATHERED GARNETS, WET. WHITE WEATHERED GNEISS 54.6 - 54.8 FT..WHITE WEATHERED GNEISS, MOTTLED",NA,SILTY SAND
MWG5-6,9,29,1985-02-18T07:00:00Z,SM,NA,"FIRM RED BROWN, BROWN, GRAY AND WHITE SILTY MICACEOUS FINE TO MEDIUM SAND",NA,SILTY SAND
MWG5-6,0,4,1985-02-18T07:00:00Z,SM,NA,SOFT RED-GRAY CLAYEY SANDY SILT,NA,SILTY SAND
MWG5-6,29,37,1985-02-18T07:00:00Z,SM,NA,VERY STIFF BROWN AND GRAY FINE SANDY SILT WITH A TRACE OF MICACEOUS FINE SANDY SILT,NA,SILTY SAND
MWG5-6,4,9,1985-02-18T07:00:00Z,ML,NA,VERY STIFF RED-BROWN AND GRAY FINE TO MEDIUM SANDY MICACEOUS SILTY CLAY - FILL,NA,SILT
MWG6,0,11.5,1986-01-14T07:00:00Z,SM,NA,"FILL. COMPACT TO DENSE, GRAY TO BROWN, FINE TO MEDIUM SAND, SOME SILT, MICACEOUS WITH ROCK, CONCRETE, AND WOOD FRAGMENTS",NA,SILTY SAND
MWG6,37.5,64.5,1986-01-14T07:00:00Z,ML,NA,"STIFF TO HARD, GRAY BROWN, SILT AND FINE SAND, VERY MICACEOUS (WEATHERED SCHIST)",NA,SILT
MWG6,64.5,77.8,1986-01-14T07:00:00Z,SM,NA,"PARTIALLY WEATHERED ROCK, SAMPLED AS VERY DENSE WHITE FINE TO MEDIUM SAND, SOME SILT, MICACEOUS (WEATHERED GNEISS)",NA,SILTY SAND
MWG6,17.5,37.5,1986-01-14T07:00:00Z,ML,NA,"FIRM TO HARD, YELLOW BROWN AND BLACK SILT, SOME FINE SAND",NA,SILT
MWG6,11.5,17.5,1986-01-14T07:00:00Z,SM,NA,"COMPACT, RED BROWN TO TAN, FINE SAND, SOME CLAYEY SILT",NA,SILTY SAND
MWG7,30.5,32.2,1985-12-19T07:00:00Z,NACM,NA,"MODERATELY HARD TO HARD, GRAY FRAGMENTED, INCOMPETENT MICA SCHIST WITH STAINED FRACTURES",NA,NACM
MWG7,32.2,51.9,1985-12-19T07:00:00Z,NACM,NA,"MODERATELY HARD TO HARD, GRAY AND WHITE FAIRLY SOLID, FAIRLY CONTINUOUS TO CONTINUOUS QUARTZ-PLAGIOCLASE-BIOTITE GNEISS FRACTURES WITH STAINS 39-41 FT.",NA,NACM
MWG7,19,27.8,1985-12-19T07:00:00Z,SM,NA,"PARTIALLY WEATHERED ROCK, SAMPLED AS VERY DENSE, TAN TO WHITE, FINE TO MEDIUM SAND, SOME SILT, MICACEOUS (WEATHERED GNEISS)",NA,SILTY SAND
MWG7,0,13,1985-12-19T07:00:00Z,ML,NA,"SOFT TO FIRM, RED BROWN, CLAYEY SILT, SOME FINE SAND, SLIGHTLY MICACEOUS",NA,SILT
