LOCID,BEGDEPTH,ENDDEPTH,LOGDATE,ASTMCODE,HS_UNIT,VISDESC,USER_COMMENTS,lithcode
B10TMW-B3,16,20,2001-08-10T06:00:00Z,ML,NA,"VERY MOIST BUT DOES NOT APPEAR SATURATED, MANGANESE MOTTLES FROM 18-19'.",NA,SILT
B10TMW-B3,4,8,2001-08-10T06:00:00Z,ML,NA,"CLAYEY SILT, RED WITH YELLOW MOTTLES, MORE YELLOW WITH DEPTH, PROBABLY NATURAL.",NA,SILT
B10TMW-B3,20,30,2001-08-10T06:00:00Z,ML,NA,"SILT, SOME CLAY, TRACE SAND, PALE YELLOW, RELICT GNEISS, SAPROLITE COMPOSED OF WHITE, TAN AND RUST COLORED MOTTLED, VERY WET SAMPLE.",NA,SILT
B10TMW-B3,30,31,2001-08-10T06:00:00Z,NA,NA,"RELICT BIOTITE SCHIST FROM 30-31'; YELLOWISH BROWN WITH MANGANESE FILLED FRACTURES, CONTACT SHARP WITH RELICT GNEISS BELOW 31'.",NA,NA
B10TMW-B3,38,39,2001-08-10T06:00:00Z,NDPS,NA,NO LITHOLOGIC DESCRIPTION PROVIDED.,NA,NDPS
B10TMW-B3,15,16,2001-08-10T06:00:00Z,NA,NA,"GRANITIC GNEISS HAS PURE WHITE KAOLINITE, MUSCOVITE BOOKS AND QUARTZ SAND TO PEA SIZED GRAVEL.",NA,NA
B10TMW-B3,11.5,13,2001-08-10T06:00:00Z,NA,NA,RELICT GNEISS SAPROLITE WITH LIGHT GRAYISH GREEN AND PALE YELLOW MOTTLES AND OCCASIONALLY PINKISH RED.,NA,NA
B10TMW-B3,8,11.5,2001-08-10T06:00:00Z,ML,NA,"SILT, TRACE CLAY, TRACE SAND, REDDISH YELLOW AT 8-9' TO PALE YELLOW AT 11' (GRADATIONAL COLOR CHANGE).",NA,SILT
B10TMW-B3,31,38,2001-08-10T06:00:00Z,NA,NA,"RELICT GNEISS COMPOSED OF WHITE, LIGHT GREENISH GRAY MOTTLES, SILT, TRACE SAND AND CLAY, VAGUE, VERY THIN GNEISS BANDING PRESENT.",NA,NA
B10TMW-I1,12,15,2001-08-06T06:00:00Z,NDPS,NA,"CONCRETE RUBBLE ENCOUNTERED, PRE-PROBED THROUGHT TO 15' BGS, NO SAMPLE COLLECTED FOR LITHOLOGIC DESCRIPTION.",NA,NDPS
B10TMW-I1,0,4,2001-08-06T06:00:00Z,NDPS,NA,"PRE-PROBED TO 4' BGS TO GET THROUGH CONCRETE RUBBLE, NO SAMPLE COLLECTED FOR LITHOLOGIC DESCRIPTION.",NA,NDPS
B10TMW-I1,4,8,2001-08-06T06:00:00Z,NDPS,NA,NO DESCRIPTION,NA,NDPS
B10TMW-I1,8,12,2001-08-06T06:00:00Z,ML,NA,"CLAYEY SILT, PINK TO YELLOW, SOFT, MOIST, WITH MUSCOVITE AND QUARTZ GRAINS, SAPROLITE OF GRANITIC GNEISS, RELICT STRUCTURE VISIBLE.",NA,SILT
B10TMW-I2,8,12,2001-08-08T06:00:00Z,CL,NA,"SILTY CLAY, REDDISH BROWN, SOME DARK GRAY REDS, TRACE ORGANICS (GRASS), MOIST - FILL MATERIAL.",NA,CLAY
B10TMW-I2,0,4,2001-08-08T06:00:00Z,ML,NA,"GRAVEL AT SURFACE GRADING TO CLAYEY SILT, RED, TRACE TO SOME GRAVEL, TRACE MUSCOVITE, SLIGHTLY MOIST - FILL MATERIAL (1/8-1 DIAMETER).",NA,SILT
B10TMW-I2,4,8,2001-08-08T06:00:00Z,ML,NA,"CLAYEY SILT, RED, SANDY, SLIGHT MOIST - FILL MATERIAL.",NA,SILT
B10TMW-I2,12,13.7,2001-08-08T06:00:00Z,SM,NA,"SILTY SAND, SOME CLAY, SOME GRAVEL, DARK GRAY, SOME GRASS, ORGANIC MATTER, WET - FILL MATERIAL, CONCRETE.",NA,SILTY SAND
B10TMW-I3,0,4,2001-08-06T06:00:00Z,SM,NA,"GRAVEL AND FILL; GRAVEL AND ORGANIC RICH SOIL IN TOP FOOT, GRADING TO RED, STIFF, DRY, CLAYEY SILT FILL MATERIAL.",NA,SILTY SAND
B10TMW-I3,6.9,8,2001-08-06T06:00:00Z,ML,NA,"CLAYEY SILT; YELLOWISH GRAY, MUSCOVITE AND QUARTZ GRAINS, SLIGHTLY MOIST, SOFT, SAPROLITE OF GRANITIC GNEISS, BECOMES YELLOW AT 14' BGS.",NA,SILT
B10TMW-I3,4,6.9,2001-08-06T06:00:00Z,SM,NA,"GRAVEL AND FILL; DARK GRAY, GRAVELLY, STIFF, DRY, CLAYEY SILT FILL MATERIAL; COLOR CHANGES TO RED IN LOWER DEPTH.",NA,SILTY SAND
B10TMW-I3,8,15,2001-08-06T06:00:00Z,ML,NA,"CLAYEY SILT; YELLOWISH GRAY, MUSCOVITE AND QUARTZ GRAINS, MOIST, SOFT, SAPROLITE OF GRANITIC GNEISS, BECOMING YELLOW AT 14' BGS.",NA,SILT
B10TMW-I4,0,5,2001-08-09T06:00:00Z,ML,NA,"GRAVEL AT SURFACE GRADING TO CLAYEY SILT, RED, SLIGHTLY MOIST - FILL MATERIAL, SOME SMALL GRAVEL AND PIECES OF PLYWOOD; BECOMES MORE BROWN WITH A FEW SMALL GRAY SPOTS WITH ORGANIC.",NA,SILT
B10TMW-I4,13.8,15.5,2001-08-09T06:00:00Z,SM,NA,"FILL/NATURAL BOUNDARY AT ~13.8'; RELICT GNEISS WITH WHITE, LIGHT GREEN AND RUST COLORED MOTTLED, VERY MOIST TO WET, BUT NOT WATER TABLE, COLOR PINKISH GRAY.",NA,SILTY SAND
B10TMW-I4,5,13.8,2001-08-09T06:00:00Z,ML,NA,"CLAYEY SILT, YELLOWISH RED, MORE MUSCOVITE, MOIST - FILL MATERIAL; OCCASIONAL GRAVEL ~1 DIAMETER AROUND 8'; PIECE OF WOOD (~1 LONG) BLACK AT ~13'; ~4 OF SILTY SAND AT BASE OF FILL, OCCASIONAL 1 DIAMETER GRAVEL.",NA,SILT
B10TMW-I5,12,15,2001-08-10T06:00:00Z,ML,NA,"SILT, SOME CLAY, LIGHT GRAY, MOTTLED PINKISH RED, GREENISH GRAY AND WHITE, RELICT GNEISS SAPROLITE (NO FOLIATION ON RELICT SCHIST TO SILTY) - MOIST.",NA,SILT
B10TMW-I5,0,4,2001-08-10T06:00:00Z,ML,NA,"GRAVEL AT SURFACE GRADING TO CLAYEY SILT, SOME GRAVEL, YELLOWISH RED, SLIGHTLY MOIST - FILL MATERIAL.",NA,SILT
B10TMW-I5,4,8,2001-08-10T06:00:00Z,ML,NA,"CLAYEY SILT, LIGHT REDDISH BROWN MOTTLED, SLIGHTLY MOIST - FILL MATERIAL.",NA,SILT
B10TMW-I5,8,12,2001-08-10T06:00:00Z,ML,NA,"SILT WITH SOME CLAY, LIGHT GRAY, RELICT MUSCOVITE SCHIST (NATURAL) WITH SOME WEATHERED FELDSPAR (KAOLINITE).",NA,SILT
B10TMW-I6,0,4,2001-08-06T06:00:00Z,NDPS,NA,NO LITHOLOGIC DESCRIPTION PROVIDED.,NA,NDPS
B10TMW-I6,8,15.8,2001-08-06T06:00:00Z,ML,NA,"CLAYEY SILT; YELLOW WITH RED LAYERS 1-2 THICK, MUSCOVITE AND QUARTZ GRAINS, SAPROLITE OF GRANITIC GNEISS, SOFT, MOIST, RELICT STRUCTURE VISIBLE.",NA,SILT
B10TMW-I6,15.8,16,2001-08-06T06:00:00Z,ML,NA,"SAPROLITE OF MUSCOVITE SCHIST, SOFT, MOIST.",NA,SILT
B10TMW-I6,4,6,2001-08-06T06:00:00Z,ML,NA,"FILL: RED CLAYEY SILT, STIFF, DRY.",NA,SILT
B10TMW-I6,6,8,2001-08-06T06:00:00Z,ML,NA,"CLAYEY SILT; YELLOW WITH RED LAYERS 1-2 THICK, MUSCOVITE AND QUARTZ GRAINS, SAPROLITE OF GRANITIC GNEISS, SOFT, SLIGHTLY MOIST, RELICT STRUCTURE VISIBLE.",NA,SILT
B10TMW-P1,8,10,2001-08-06T06:00:00Z,ML,NA,"CLAYEY SILT, YELLOW TO RED, MUSCOVITE AND QUARTZ GRAINS, SAPROLITE OF GRANITIC GNEISS, RELICT STRUCTURE IN PLACES, SOFT, MOIST.",NA,SILT
B10TMW-P1,5.9,8,2001-08-06T06:00:00Z,ML,NA,"CLAYEY SILT, YELLOW TO RED, STIFF, DRY, MUSCOVITE AND QUARTZ GRAINS, SAPROLITE OF GRANITIC GNEISS, RELICT STRUCTURE IN PLACES.",NA,SILT
B10TMW-P1,10,11,2001-08-06T06:00:00Z,NDPS,NA,NO SAMPLE COLLECTED FOR LITHOLOGIC DESCRIPTION.,NA,NDPS
B10TMW-P1,11,15,2001-08-06T06:00:00Z,ML,NA,"CLAYEY SILT, YELLOW ENTIRE LENGTH, SOFT, MOIST, RELICT STRUCTURE VISIBLE.",NA,SILT
B10TMW-P1,0,5.9,2001-08-06T06:00:00Z,MH,NA,"FILL: GRAVELLY TO 1 FT, RED CLAYEY SILT, NO STRUCTURE, STIFF, DRY.",NA,SILT
B10TMW-P2,8,12,2001-08-10T06:00:00Z,ML,NA,"SILT, SOME CLAY, TRACE SAND, YELLOW, OCCASIONALLY RED CLAY MOTTLES, AT 12' MUSCOVITE BOOK ~1/2 IN DIAMETER.",NA,SILT
B10TMW-P2,4,8,2001-08-10T06:00:00Z,ML,NA,"CLAYEY SILT, TRACE SAND, MOSTLY  RED WITH REDDISH YELLOW MOTTLES, APPEARS NATURAL, VERY MOIST.",NA,SILT
B10TMW-P2,12,15,2001-08-10T06:00:00Z,ML,NA,"SILT, SOME SAND (VERY FINE GRAINED) AND CLAY, VERY PALE BROWN, WHITE, PINKISH RED AND LIGHT GREENISH GRAY MOTTLES, RELICT GNEISS SAPROLITE.",NA,SILT
B10TMW-P2,0,4,2001-08-10T06:00:00Z,ML,NA,"GRAVEL AT SURFACE GRADING TO CLAYEY SILT, TRACE TO SOME SAND AND GRAVEL, RED TO DARK REDDISH GRAY AT BOTTOM, SLIGHTLY MOIST; PIECES OF WOOD AND PLASTIC, WIRE INSULATION AT BOTTOM - FILL.",NA,SILT
B10TMW-P3,0,5,2001-08-06T06:00:00Z,NDPS,NA,NO SAMPLE COLLECTED FOR LITHOLOGIC DESCRIPTION PROVIDED.,NA,NDPS
B10TMW-P3,8,16,2001-08-06T06:00:00Z,ML,NA,"CLAYEY SILT, YELLOW TO RED, SOFT, MOIST, MUSCOVITE AND QUARTZ GRAINS, SAPROLITE OF GRANITIC GNEISS, RELICT STRUCTURE VISIBLE.",NA,SILT
B10TMW-P3,5,8,2001-08-06T06:00:00Z,ML,NA,"CLAYEY SILT, YELLOW TO RED, SOFT, SLIGHTLY MOIST TO MOIST, MUSCOVITE AND QUARTZ GRAINS, SAPROLITE OF GRANITIC GNEISS, RELICT STRUCTURE VISIBLE.",NA,SILT
B10TMW-P4,12,14,2001-08-08T06:00:00Z,CL,NA,"WET, RED, ABRUPT CONTACT, NO RELICT STRUCTURE, SILTY CLAY.",NA,CLAY
B10TMW-P4,14,15,2001-08-08T06:00:00Z,SM,NA,"CONTACT BETWEEN RED GRAY AND RELICT GNEISS ~70 DEGREES DIP AT ~14', ABURPT CHANGES TO RELICT GNEISS, WHITE, SOME QUARTZ GRAVEL, ANGULAR, MUSCOVITE.",NA,SILTY SAND
B10TMW-P4,10,12,2001-08-08T06:00:00Z,ML,NA,"RELICT STRUCTURE - PROBABLY GNEISS AT 10', CLAYEY SILT, REDDISH YELLOW, VERY MOIST.",NA,SILT
B10TMW-P4,0,7,2001-08-08T06:00:00Z,ML,NA,"GRAVEL AT SURFACE GRADING TO CLAYEY SILT, RED, TRACE SO SOME GRAVEL 1/8 DIAMETER TO 1 DIAMETER, TRACE TO SOME MUSCOVITE, SLIGHTLY MOIST - FILL MATERIAL.",NA,SILT
B10TMW-P4,7,10,2001-08-08T06:00:00Z,ML,NA,"CLAYEY SILT, SOFTER BROWN WITH TRACE TO SOME GRASS AND OTHER ORGANIC MATERIAL, SLIGHTLY MOIST TO MOIST - FILL MATERIAL.",NA,SILT
B10TMW-P5,3,8.5,2001-08-09T06:00:00Z,ML,NA,"SILT, TRACE SAND, GRAVEL AND AND MORE CLAYEY THAN ABOVE AT ~3'; CLAYEY SILT, SLIGHTLY PLASTIC, SOME GRAVEL (CONCRETE AND WEATHERED GNEISS), RED, SLIGHTLY MOIST - FILL MATERIAL.",NA,SILT
B10TMW-P5,12,13.7,2001-08-09T06:00:00Z,SM,NA,"SILTY SAND, DARK GRAY, SOME GRAVEL, FINE TO COARSE GRAINED, SAND = ANGULAR QUARTZ, VERY MOIST TO WET.",NA,SILTY SAND
B10TMW-P5,0,3,2001-08-09T06:00:00Z,ML,NA,"GRAVEL AT SURFACE GRADING TO SILT, TRACE SAND, GRAVEL AND CLAY, LIGHT RED, SLIGHTLY MOIST, GRAVEL IS CONCRETE UP TO ~1 DIAMETER - FILL MATERIAL.",NA,SILT
B10TMW-P5,8.5,12,2001-08-09T06:00:00Z,SM,NA,"FILL CHANGES TO GRAY COLOR AND LESS CLAYEY; GRAY, SILTY SAND, VERY ORGANIC, SOME PIECES OF WOOD, SOME GRAVEL (TCE? SATURATED GRAVEL THAT IS PROBABLY CONCRETE FROM OLD IWTP CONCRETE), MOIST.",NA,SILTY SAND
B10TMW-P6,0,4,2001-08-01T06:00:00Z,NDPS,NA,NO SAMPLE COLLECTED FOR LITHOLOGIC DESCRIPTION.,NA,NDPS
B10TMW-P6,12,15,2001-08-01T06:00:00Z,NDPS,NA,NO SAMPLE COLLECTED FOR LITHOLOGIC DESCRIPTION.,NA,NDPS
B10TMW-P6,11,12,2001-08-01T06:00:00Z,ML,NA,"CLAYEY SILT, SAPROLITE OF GRANITIC GNEISS, FELDSPAR AND MUSCOVITE RICH, QUARTZ GRAINS 20%, RELICT STRUCTURE VISIBLE, MOIST, WHITE AND REDDISH YELLOW, SOFT.",NA,SILT
B10TMW-P6,7,11,2001-08-01T06:00:00Z,ML,NA,"CLAYEY SILT, RED AND REDDISH YELLOW, MOIST, RELICT FOLIATION VISIBLE, STIFF, SAPROLITE OF MUSCOVITE SCHIST, SOFT.",NA,SILT
B10TMW-P6,4,7,2001-08-01T06:00:00Z,ML,NA,"FILL: RED, CLAYEY SILT TO SILTY CLAY, MOTTLED, GRAVELLY, FELDSPAR AND MUSCOVITE GRAINS, STIFF, DRY.",NA,SILT
B10TMW-P7,7,8,2001-08-02T06:00:00Z,ML,NA,"CLAYEY SILT, HIGHLY FELDSPATHIC, REDDISH YELLOW, MUSCOVITE AND QUARTZ GRAINS, SAPROLITE OF GRANITIC GNEISS, SLIGHTLY MOIST, HARD.",NA,SILT
B10TMW-P7,4,7,2001-08-02T06:00:00Z,ML,NA,"FILL: RED TO REDDISH YELLOW, MORE SILTY CLAY THAN ABOVE, STIFF, DRY, LARGE MUSCOVITE FLAKES.",NA,SILT
B10TMW-P7,12,16,2001-08-02T06:00:00Z,ML,NA,"CLAYEY SILT, HIGHLY FELDSPATHIC, REDDISH YELLOW, MUSCOVITE AND QUARTZ GRAINS, SAPROLITE OF GRANITIC GNEISS, MOIST, SOFT; COLOR GRADES TO A RED AND SHITE MATRIX AT 14'.",NA,SILT
B10TMW-P7,0.8,4,2001-08-02T06:00:00Z,ML,NA,"FILL: RED TO REDDISH YELLOW, STIFF CLAYEY SILT, WOOD FOUND ~15 BGS, DRY.",NA,SILT
B10TMW-P7,8,12,2001-08-02T06:00:00Z,ML,NA,"CLAYEY SILT, HIGHLY FELDSPATHIC, REDDISH YELLOW, MUSCOVITE AND QUARTZ GRAINS, SAPROLITE OF GRANITIC GNEISS, MOIST, SOFT.",NA,SILT
B10TMW-P7,0,0.8,2001-08-02T06:00:00Z,GC,NA,FILL: GRAVEL AND ORGANIC SOIL.,NA,CLAYEY GRAVEL
B10TMW-P8,0,7.7,2001-08-01T06:00:00Z,MH,NA,"NO SAMPLE IN TOP HALF OF TUBE: CLAYEY SILT, RED, GRAVELLY, MIACEOUS WITH QUARTZ PEBBLES, FELDSPAR INCLUSIONS, FILL MATERIAL, SLIGHTLY MOIST.",NA,SILT
B10TMW-P8,7.7,14,2001-08-01T06:00:00Z,MH,NA,"CLAYEY SILT, HIGHLY FELDSPATHIC, MUSCOVITE AND QUARTZ GRAINS, WHITE TO REDDISH YELLOW, SAPROLITE OF GRANITIC GNEISS, NO SAMPLE FROM 8-10' BGS.",NA,SILT
B10TMW-W1,8,10,2001-08-10T06:00:00Z,ML,NA,"CLAYEY SILT, YELLOW TO RED, MUSCOVITE AND QUARTZ GRAINS, SAPROLITE OF GRANITIC GNEISS, RELICT STRUCTURE IN PLACES, SOFT, MOIST.",NA,SILT
B10TMW-W1,0,5.9,2001-08-10T06:00:00Z,MH,NA,"FILL: GRAVELLY TO 1 FT, RED CLAYEY SILT, NO STRUCTURE, STIFF, DRY.",NA,SILT
B10TMW-W1,5.9,8,2001-08-10T06:00:00Z,ML,NA,"CLAYEY SILT, YELLOW TO RED, STIFF, DRY, MUSCOVITE AND QUARTZ GRAINS, SAPROLITE OF GRANITIC GNEISS, RELICT STRUCTURE IN PLACES.",NA,SILT
B10TMW-W1,11,15,2001-08-10T06:00:00Z,ML,NA,"CLAYEY SILT, YELLOW ENTIRE LENGTH, SOFT, MOIST, RELICT STRUCTURE VISIBLE.",NA,SILT
B10TMW-W1,10,11,2001-08-10T06:00:00Z,NDPS,NA,NO SAMPALE COLLECTED FOR LITHOLOGIC DESCRIPTIO.,NA,NDPS
B10TMW-W2,0,8,2001-08-01T06:00:00Z,NDPS,NA,NO SAMPLE COLLECTED FOR LITHOLOGIC DESCRIPTION.,NA,NDPS
B10TMW-W2,8,10,2001-08-01T06:00:00Z,MH,NA,"FILL: RED CLAYEY SILT, GRAVELLY IN TOP 2', MICACEOUS, FELDSPAR GRAINS, MOTTLED, NO STRUCTURE.",NA,SILT
B10TMW-W2,10,12,2001-08-01T06:00:00Z,ML,NA,"CLAYEY SILT, WHITE TO REDDISH YELLOW, HIGHLY FELDSPATHIC, MUSCOVITE AND QUARTZ GRAINS, SAPROLITE OF GRANITIC GNEISS, RELICT STRUCTURE VISIBLE, SLIGHTLY MOIST, SOFT.",NA,SILT
B10TMW-W2,20,25,2001-08-01T06:00:00Z,ML,NA,"CLAYEY SILT, WHITE TO REDDISH YELLOW, HIGHLY FELDSPATHIC, MUSCOVITE AND QUARTZ GRAINS, SAPROLITE OF GRANITIC GNEISS, RELICT STRUCTURE VISIBLE, SATURATED, SOFT.",NA,SILT
B10TMW-W2,12,16,2001-08-01T06:00:00Z,ML,NA,"CLAYEY SILT, WHITE TO REDDISH YELLOW, HIGHLY FELDSPATHIC, MUSCOVITE AND QUARTZ GRAINS, SAPROLITE OF GRANITIC GNEISS, RELICT STRUCTURE VISIBLE, MOIST, SOFT.",NA,SILT
B10TMW-W2,16,20,2001-08-01T06:00:00Z,ML,NA,"CLAYEY SILT, WHITE TO REDDISH YELLOW, HIGHLY FELDSPATHIC, MUSCOVITE AND QUARTZ GRAINS, SAPROLITE OF GRANITIC GNEISS, RELICT STRUCTURE VISIBLE, WET, SOFT.",NA,SILT
B10TMW-W3,13.5,14,2001-08-01T06:00:00Z,ML,NA,"CLAYEY SILT, SAPROLITE OF GRANITIC GNEISS, HIGHLY FELDSPATHIC, MUSCOVITE AND QUARTZ GRAINS, MOIST, RELICT STRUCTURE VISIBLE, SOFT.",NA,SILT
B10TMW-W3,16,25,2001-08-01T06:00:00Z,ML,NA,"CLAYEY SILT, SAPROLITE OF GRANITIC GNEISS, WET, SOFT.",NA,SILT
B10TMW-W3,0,4,2001-08-01T06:00:00Z,NDPS,NA,NO SAMPLE COLLECTED FOR LITHOLOGIC DESCRIPTION.,NA,NDPS
B10TMW-W3,14,16,2001-08-01T06:00:00Z,ML,NA,"CLAYEY SILT, SAPROLITE OF MUSCOVITE SCHIST, GRANITIC GNEISS, HIGHLY FELDSPATHIC, MUSCOVITE AND QUARTZ GRAINS, DRY, RELICT STRUCTURE VISIBLE, SOFT.",NA,SILT
B10TMW-W3,7,12,2001-08-01T06:00:00Z,ML,NA,"CLAYEY SILT, SAPROLITE OF MUSCOVITE, SCHIST, SLIGHTLY MOIST, SOME FELDSPAR, SOFT, DARK YELLOWISH BROWN, LOOSE.",NA,SILT
B10TMW-W3,12,13.5,2001-08-01T06:00:00Z,ML,NA,"CLAYEY SILT, SAPROLITE OF MUSCOVITE, SCHIST, MOIST, SOME FELDSPAR, SOFT, DARK YELLOWISH BROWN, LOOSE.",NA,SILT
B10TMW-W3,4,7,2001-08-01T06:00:00Z,MH,NA,"FILL: RED TO REDDISH YELLOW, CLAYEY SILT, MOTTLED, SITFF, DRY.",NA,SILT
B10TMW-W4,8,12,2001-08-02T06:00:00Z,ML,NA,"CLAYEY SILT, YELLOW, STIFF, MOIST, WITH MUSCOVITE AND QUARTZ GRAINS, RELICT FEATURE VISIBLE FROM 9' DOWN, SAPROLITE OF GRANITIC GNEISS.",NA,SILT
B10TMW-W4,0,4,2001-08-02T06:00:00Z,MH,NA,"FILL: RED TO LIGHT OLIVE BROWN TO YELLOWISH BROWN CLAYEY SILT, STIFF, DRY, GRAVEL IN 1ST FOOT.",NA,SILT
B10TMW-W4,7,8,2001-08-02T06:00:00Z,ML,NA,"CLAYEY SILT, YELLOW, STIFF, DRY, WITH MUSCOVITE AND QUARTZ GRAINS, NO RELICT FEATURES, SAPROLITE OF GRANITIC GNEISS.",NA,SILT
B10TMW-W4,20.5,25,2001-08-02T06:00:00Z,ML,NA,"CLAYEY SILT, NORMAL WHITE AND GOLD (MUSCOVITE) COLOR OF GRANITIC GNEISS SAPROLITE, SATURATED FROM 21' DOWN, SOFT.",NA,SILT
B10TMW-W4,4,7,2001-08-02T06:00:00Z,MH,NA,"RED AND REDDISH YELLOW CLAYEY SILT, STIFF, DRY.",NA,SILT
B10TMW-W4,12,20.5,2001-08-02T06:00:00Z,ML,NA,"CLAYEY SILT, RED AND WHITE, SOFT, MOIST, WITH MUSCOVITE AND QUARTZ GRAINS, RELICT FEATURE VISIBLE, SAPROLITE OF GRANITIC GNEISS.",NA,SILT
B10TMW-W5,13,20,2001-08-01T06:00:00Z,ML,NA,"CLAYEY SILT, SAPROLITE OF GRANITIC GNEISS; MUSCOVITE AND QUARTZ GRAINS, WHITE TO REDDISH YELLOW, RELICT STRUCTURE VISIBLE, MOIST.",NA,SILT
B10TMW-W5,12,13,2001-08-01T06:00:00Z,NDPS,NA,NO SAMPLE.,NA,NDPS
B10TMW-W5,1.5,7,2001-08-01T06:00:00Z,ML,NA,"FILL: RED, GRAVELLY, CLAYEY SILT, DRY, MOTTLED COLORING, MICACEOUS, STIFF.",NA,SILT
B10TMW-W5,20,25,2001-08-01T06:00:00Z,ML,NA,"CLAYEY SILT, DARK YELLOWISH BROWN, MUSCOVITE RICH, WITH FELDSPAR INCLUSIONS OR GRAINS, SAPROLITE OF MUSCOVITE SCHIST, MOIST, RELICT FOLIATION VISIBLE, MANGANESE SPOTTING.",NA,SILT
B10TMW-W5,0,1.5,2001-08-01T06:00:00Z,NDPS,NA,GRAVEL AT SURFACE; NO SAMPLE COLLECTED FOR LITHOLOGIC DESCRIPTION TOP 1.5' BGS.,NA,NDPS
B10TMW-W5,9,12,2001-08-01T06:00:00Z,ML,NA,"CLAYEY SILT, SAPROLITE OF GRANITIC GNEISS; MUSCOVITE AND QUARTZ GRAINS, WHITE TO REDDISH YELLOW, RELICT STRUCTURE VISIBLE, MOIST.",NA,SILT
B10TMW-W5,8,9,2001-08-01T06:00:00Z,NDPS,NA,"NO SAMPLE, LOST CORE AND REPUSHED TO 13' BGS TO GRAB SAMPLE.",NA,NDPS
B10TMW-W5,7,8,2001-08-01T06:00:00Z,ML,NA,"CLAYEY SILT, SAPROLITE OF GRANITIC GNEISS; MUSCOVITE AND QUARTZ GRAINS, WHITE TO REDDISH YELLOW, RELICT STRUCTURE VISIBLE, MOIST.",NA,SILT
B10TMW-W6,28,30,2001-07-31T06:00:00Z,NDPS,NA,NO SAMPLE COLLECTED FOR LITHOLOGIC DESCRIPTION.,NA,NDPS
B10TMW-W6,37,39,2001-07-31T06:00:00Z,ML,NA,"CLAYEY SILT, SAPROLITE OF MUSCOVITE GRANITE GNEISS, HIGHLY FELDSPATHIC, SATURATED.",NA,SILT
B10TMW-W6,0,8,2001-07-31T06:00:00Z,MH,NA,"SILT, MICACEOUS, CLAYEY, GRAVELLY FIRST FOOT, RED WITH WHITE SILT LAYERS, FELDSPAR AND MUSCOVITE GRAVEL, GRANITIC GNEISS ROCK GRAVEL, FILL MATERIAL, DRY.",NA,SILT
B10TMW-W6,9,16.5,2001-07-31T06:00:00Z,MH,NA,"PALE YELLOW SILT WITH MUSCOVITE FLAKES, SLIGHTLY CLAYEY, SAPROLITE OF GRANITIC GNEISS, HIGHLY FELDSPATHIC, MINOR QUARTZ GRAINS, RELICT STRUCTURE VIAIBLE, MOIST.",NA,SILT
B10TMW-W6,39,40,2001-07-31T06:00:00Z,ML,NA,"CLAYEY SILT, SAPROLITE OF MUSCOVITE GRANITE GNEISS, HIGHLY FELDSPATHIC, MOIST.",NA,SILT
B10TMW-W6,16.5,19,2001-07-31T06:00:00Z,MH,NA,"PALE YELLOW SILT WITH MUSCOVITE FLAKES, SLIGHTLY CLAY, SAPROLITE OF GRANITIC GNEISS, HIGHLY FELDSPATHIC, MINOR QUARTZ GRAINS, RELICT STRUCTURE VIAIBLE, SATURATED.",NA,SILT
B10TMW-W6,35.2,37,2001-07-31T06:00:00Z,ML,NA,"CLAYEY SILT, SAPROLITE OF MUSCOVITE GRANITE GNEISS, HIGHLY FELDSPATHIC, MOIST.",NA,SILT
B10TMW-W6,8,9,2001-07-31T06:00:00Z,NDPS,NA,NO SAMPLE COLLECTED FOR LITHOLOGIC DESCRIPTION.,NA,NDPS
B10TMW-W6,30,34.5,2001-07-31T06:00:00Z,ML,NA,"CLAYEY SILT, SAPROLITE OF MUSCOVITE GRANITE GNEISS, HIGHLY FELDSPATHIC, MOIST.  IRON STAINING FROM 34-35' BGS.",NA,SILT
B10TMW-W6,19,23,2001-07-31T06:00:00Z,ML,NA,"FOLIATION APPEARS TO BE 30 DEGREE OFF HORIZONTAL.  CLAYEY SILT, YELLOWISH BROWN TO DARK YELLOWISH BROWN, WEATHERED SCHIST, MOSTLY MUSCOVITE, MINOR FELDSPAR (WENT TO CLAY), SOME AS AUGERS, SLIGHTLY MOIST, IRON STAINING BELOW 22-23' BGS.",NA,SILT
B10TMW-W6,34.5,35.2,2001-07-31T06:00:00Z,ML,NA,"CLAYEY SILT, SAPROLITE OF MUSCOVITE GRANITE GNEISS, HIGHLY FELDSPATHIC, SATURATED.",NA,SILT
B10TMW-W6,23,28,2001-07-31T06:00:00Z,ML,NA,"CLAYEY SILT, SAPROLITE OF MUSCOVITE GRANITE GNEISS, HIGHLY FELDSPATHIC, MOIST.",NA,SILT
B10VW1,15,17,1995-03-20T07:00:00Z,SCSM,NA,"SAND, MEDIUM TO FINE, SILTY, MICACEOUS, RELICT LAMINATION, DRY. 5 MM THICK BLACK VEINLETS IN LOWER 1 FT. 5YR5/8",NA,CLAYEY SAND
B10VW1,20,22,1995-03-20T07:00:00Z,SCSM,NA,"SAND, MEDIUM TO FINE, SILTY, MICACEOUS, RELICT LAMINATION. 0.25 FT QUARTZ VEIN AT 21 FT. 5YR4/6 FROM 20-21, 10YR6/8 FROM 21-22.",NA,CLAYEY SAND
B10VW1,2,4,1995-03-20T07:00:00Z,SW,NA,"SAND, MEDIUM, MICACEOUS, RED BROWN, DRY.",NA,SAND
B10VW1,5,7,1995-03-20T07:00:00Z,SCSM,NA,"SAND, FINE, SILTY TO CLAYEY, DRY. 5YR5/8",NA,CLAYEY SAND
B10VW1,10,12,1995-03-20T07:00:00Z,SCSM,NA,"SAND, MEDIUM TO FINE, SILTY, MICACEOUS, RELICT LAMINATION, DRY. 2.5YR4/8, SOME 2.5Y6/8 MOTTLES",NA,CLAYEY SAND
B10VW1,0,2,1995-03-20T07:00:00Z,SCSM,NA,"SAND, SILTY, MEDIUM TO FINE, MICACEOUS, WOOD CHIPS, DRY. RED BROWN.",NA,CLAYEY SAND
B4MWA,40,50,1997-07-21T06:00:00Z,SM,NA,"VERY DENSE, PALE OLIVE, MOTTLED ( YELLOW, RED, AND BLACK),  LAMINATED, MICACEOUS, FINE TO VERY COARSE GRAIN, SAND, QUARTZ, TRACE SILT, SUBROUNDED TO SUBANGULAR, MOIST. SS-11 1045, RECOVERY 1.0/2.0, SS-12 1100, RECOVERY 1.3/2.0. BLACK VEINS",NA,SILTY SAND
B4MWA,19,20,1997-07-21T06:00:00Z,SM,NA,"VERY DENSE CLAY, MOTTLED (YELLOW BROWN, BLACK), LAMINATED, BRITTLE MICACEOUS, FINE TO VERY COARSE GRAIN SAND, SUBROUND TO SUBANGULAR, TRACE SILT/GRAVEL, SLIGHTLY DAMP. SS-6 0920, RECOVERY 1.5/2.0.",NA,SILTY SAND
B4MWA,10,19,1997-07-21T06:00:00Z,MH,NA,"HARD, RED MOTTLED (5YR 5/8), YELLOW RED AND BROWN YELLOW, LAMINATED, BRITTLE MICACEOUS,SANDY SILT, TRACE CLAY, MEDIUM PLASTICITY, SLIGHTLY DAMP, TRACE GRAVEL. SS-4 0830, RECOVERY 2.0/2.0, SS-5 0845, RECOVERY 1.5/2.0.",NA,SILT
B4MWA,1.5,3.2,1997-07-21T06:00:00Z,NDPS,NA,"FILL STRONG BROWN, FINE SAND, TRACE FINE SOIL, MEDIUM SUBROUNDED, QUARTZ GRAVEL, MICACEOUS, DRY. DESCRIBED FROM CUTTINGS, NO SPLIT SPOON SAMPLE COLLECTED.",NA,NDPS
B4MWA,50,56,1997-07-21T06:00:00Z,SM,NA,"VERY DENSE, WHITE, MOTTLED ( GRAY / LIGHT GRAY), FINE TO VERY COARSE GRAIN, MICACEOUS, SAND, QUARTZ, SUBROUNDED, TO SUBANGULAR, TRACE SILT, MOIST. SS13- 1120, RECOVERY 1.0/2.0, MOTTLED BLACK, YELLOW RED AT 54'. AUGER REFUSAL AT 56'.",NA,SILTY SAND
B4MWA,20,30,1997-07-21T06:00:00Z,SM,NA,"VERY DENSE, PALE OLIVE, MOTTLED (WHITE, BLACK, YELLOW BROWN), LAMINATED, BRITTLE, MICACEOUS, FINE TO VERY COARSE GRAIN, SAND, SUBANGULAR TO SUBROUNDED, TRACE SILT, SLIGHTLY DAMP. SS-6 0920, RECOVERY 1.5/2.0, SS-7 0935, RECOVERY 1.5/2.0, SS-",NA,SILTY SAND
B4MWA,3.2,5,1997-07-21T06:00:00Z,MH,NA,"HARD, RED MOTTLED (YELLOW BROWN), VERY FINE GRAIN, SANDY SILT, TRACE CLAY, MICACEOUS, MEDIUM PLASTICITY, SLIGHTLY DAMP, < 5% MEDIUM QUARTZ, GRAVEL, ANGULAR. SS-1 1735. RECOVERY 2.0/2.0.",NA,SILT
B4MWA,7,10,1997-07-21T06:00:00Z,MH,NA,"VERY STIFF, RED MOTTLED  YELLOW (LAMINATED), VERY FINE GRAIN, SANDY SILT, TRACE CLAY, MICACEOUS, MEDIUM PLASTICITY, DAMP, < 11% GRAVEL, DAMP, BRITTLE. SS-3 0820, RECOVERY 0.9/2.0, AT 9' BECOMING HARD, NO GRAVEL, SS-4 0830, RECOVERY 2.0/2.0",NA,SILT
B4MWA,0.5,1.5,1997-07-21T06:00:00Z,NDPS,NA,BRICK.,NA,NDPS
B4MWA,0,0.5,1997-07-21T06:00:00Z,NDPS,NA,CONCRETE.,NA,NDPS
B4MWA,30,40,1997-07-21T06:00:00Z,SM,NA,"VERY DENSE, PALE OLIVE, MOTTLED (WHITE, BLACK), LAMINATED, MICACEOUS, FINE TO VERY COARSE GRAIN, SAND, QUARTZ, SUBROUNDED TO SUBANGULAR, TRACE SILT, DAMP. SS-8 0955, RECOVERY 1.4/2.0, SS-9 1010, RECOVERY 1.4/2.0, ENCOUNTERED GROUNDWATER  BE",NA,SILTY SAND
B4MWA,5,7,1997-07-21T06:00:00Z,MH,NA,"FILL, STIFF, RED, MOTTLED (YELLOW BROWN), VERY FINE GRAIN , SANDY SILT, TRACE CLAY, MICACEOUS, MEDIUM PLASTICITY, DAMP, < 5% MEDIUM QUARTZ, GRAVEL, ANGULAR. SS-2 0810, RECOVERY 1.9/2.0.",NA,SILT
B4MWAA,3.2,4,1997-10-13T06:00:00Z,ML,NA,"FILL: STIFF, RED, HOMOGENEOUS, LOW PLASTICITY, SILT, LITTLE SAND, MICACEOUS, ORGANICS (ROOTS).  @ 4-6' BLOW COUNT = 7/13/, 15/12 AND RECOVERY = SS-3, 1000, SILT LAYER WITH SAND 4.9-5.1' , 2.0/2.0.",NA,SILT
B4MWAA,72.5,75.3,1997-10-13T06:00:00Z,SM,NA,"VERY DENSE, DARK YELLOWISH BROWN, MOTTLED (DARK GRAY, YELLOWISH BROWN), VERY FINE GRAIN, SAND, SOME SILT, VERY MICACEOUS, RELICT STRUCTURE, VERY WEATHERED GARNETS, SCHIST FRAGMENTS.  AUGER REFUSAL AT 75.3',  TOTAL DEPTH = 75.3'.  @ 73-73.3",NA,SILTY SAND
B4MWAA,4,11,1997-10-13T06:00:00Z,SM,NA,"FILL:  MEDIUM DENSE RED, MOTTLED, WHITE, LIGHT BROWN, VERY FINE GRAIN, SAND, LITTLE SILT, RELICT STRUCTURE, SCHIST, MANGANESE, MICACEOUS.  AT 7' COLOR CHANGING TO STRONG BROWN, MOTTLED ORANGISH RED, BLACK.  @ 6-8' BLOW COUNT = 10/17/, 24/27",NA,SILTY SAND
B4MWAA,11,22,1997-10-13T06:00:00Z,SM,NA,"MEDIUM DENSE, STRONG BROWN, MOTTLED (RED, BROWNISH YELLOW), VEY FINE GRAIN, SAND, SOME SILT, MICACEOUS, RELICT STRUCTURE (SCHIST), TRACE SCHIST FRAGMENTS.  @ 13-15' BLOW COUNT = 8/9/, 13/22 AND RECOVERY = SS-6, 1020, 2.0/2.0.  @ 18-20' BLOW",NA,SILTY SAND
B4MWAA,42.5,53,1997-10-13T06:00:00Z,SM,NA,"DENSE, DARK YELLOWISH BROWN, MOTTLED (LIGHT BROWN, WHITE, PINK, BLACK) VERY FINE GRAIN, SAND, SOME SILT, MICACEOUS, RELICT STRUCTURE.  AT 48' COLOR DECREASING CHROMA DARK BROWN, MOTTLED (BROWN, BLACK).  @ 43-44.7' BLOW COUNT = 11/18/, 40/50",NA,SILTY SAND
B4MWAA,0,0.3,1997-10-13T06:00:00Z,ML,NA,"FILL: SOFT, DARK YELLOWISH BROWN, HOMOGENEOUS, NO PLASTICITY, SILT, LITTLE SAND, ORGANICS (ROOTS).   @ 0-2' BLOW COUNT = 4/5/, 8/6 AND RECOVERY = SS-1, 0950, 1.7/2.0.",NA,SILT
B4MWAA,53,62.5,1997-10-13T06:00:00Z,SM,NA,"VERY DENSE, DARK BROWN, MOTTLED (BLACK, ORANGISH BROWN, GRAY), VERY FINE GRAIN, SAND, SOME SILT, RELICT STRUCTURE, BLACK MANGANESE IN FOLIATION PLANES (WEATHERED). AT 58' COLOR DECREASING CHROMA TO VERY DARK GRAYISH BROWN.  @  53-55' BLOW C",NA,SILTY SAND
B4MWAA,62.5,72.5,1997-10-13T06:00:00Z,SM,NA,"VERY DENSE, VERY DARK GRAYISH BROWN, MOTTLED (GRAY, WHITE, BLACK) VERY FINE GRAIN, SAND, SOME SILT, RELICT STRUCTURE, 70 DEGREES DIP, SCHIST FRAGMENTS.  @ 63-63.9' BLOW COUNT = 32/50 FOR 5 AND RECOVERY = SS-16, 1200, 0.9/0.9. WEATHERED GNE",NA,SILTY SAND
B4MWAA,0.3,3.2,1997-10-13T06:00:00Z,SM,NA,"FILL: MEDIUM DENSE, STRONG BROWN, FINE GRAIN, MOTTLED, RED LIGHT BROWN, SAND SOME SILT, SMALL PEBBLES, MICACEOUS, ORGANICS (ROOTS).  @ 2-4' BLOW COUNT = 6/9/, 5/8 AND RECOVERY = SS-2, 0952, 1.6/2.0.",NA,SILTY SAND
B4MWAA,32,42.5,1997-10-13T06:00:00Z,SM,NA,"DENSE, STRONG BROWN, MOTTLED (REDDISH BROWN, PINK), VERY FINE GRAIN, SAND, SOME SILT, BLACK MANGANESE IN FOLIATIONS (5%), RELICT STRUCTURE, VERY WEATHERED SCHIST FRAGMENTS (2%).  COLOR CHANGING TO DARK YELLOWISH BROWN, MOTTLED, DARK BROWN,",NA,SILTY SAND
B4MWAA,22,32,1997-10-13T06:00:00Z,SM,NA,"DENSE, STRONG BROWN, MOTTLED (LIGHT BROWN, RED BLACK), VERY FINE GRAIN, SAND, SOME SILT, VERY MICACEOUS, BLACK MANGANESE (IN FOLIATIONS) RELICT STRUCTURE, 60 DEGREES DIP.   COLOR CHANGE AT 28' TO WHITE, MOTTLED LIGHT BROWN, BLACK QUARTZ GRA",NA,SILTY SAND
B4MWBB,10,20,1997-10-23T06:00:00Z,ML,NA," DARK RED, HOMOGENEOUS,  NO PLASTICITY, VERY FINE GRAIN, SILT, SOME SAND, VERY MICACEOUS, MOIST, (SAPROLITE).",NA,SILT
B4MWBB,30,40,1997-10-23T06:00:00Z,SM,NA,"YELLOWISH BROWN, HOMOGENEOUS, VERY FINE GRAIN, SAND, SOME SILT, VERY MICACEOUS, DRY.",NA,SILTY SAND
B4MWBB,40,44.4,1997-10-23T06:00:00Z,SM,NA,"OLIVE BROWN, HOMOGENEOUS, VERY FINE GRAIN, SAND, SOME SILT, VERY MICACEOUS, RELIC STRUCTURE, SCHIST FRAGMENTS, WEATHERED GARNETS, MOIST. A REFUSAL AT 44.4 FT., PREVIOUS GEOPROBE REFUSAL AT 41FT., CAN HEAR WATER TRICKLING INTO BOREHOLE.",NA,SILTY SAND
B4MWBB,0.3,10,1997-10-23T06:00:00Z,ML,NA,"HOMOGENEOUS, NO PLASTICITY, VERY FINE GRAIN, SILT, SOME SAND, DRY. NO SPLIT SPOON SOIL SAMPLES COLLECTED. SEE GEOPROBE BORING B96SRHP034 FOR DETAILED LITHOLOGIC DESCRIPTION.",NA,SILT
B4MWBB,0,0.3,1997-10-23T06:00:00Z,NDPS,NA,ASPHALT.,NA,NDPS
B4MWBB,20,30,1997-10-23T06:00:00Z,ML,NA," DARK RED, HOMOGENEOUS,  NO PLASTICITY, VERY FINE GRAIN, SILT, SOME SAND, RELIC STRUCTURE, DRY.",NA,SILT
B4MWDD,22,24,2000-12-12T07:00:00Z,ML,NA,"SAPROLITE, SILT WITH SLIGHT COMPOSITIONAL  BANDING OF AMPHIBOLES, TAN, MICACEOUS.",NA,SILT
B4MWDD,26,28,2000-12-12T07:00:00Z,ML,NA,"SAPROLITE, SILTY WITH RELICT BANDING, MICACEOUS, TAN WITH WHITE PLAGIOCLASE.",NA,SILT
